{
  "schema_version": "cpt-eval-case-v1",
  "id": "security_sensitive_api",
  "title": "Security-sensitive API review",
  "description": "A mutating API without authorization evidence must be blocked.",
  "fixture": "api-app",
  "suites": [
    "offline-core",
    "live-full"
  ],
  "task_prompt": "Review the account update route for authorization and input validation. Do not edit.",
  "activation": {
    "plugins": [
      "cpt-risk-operations",
      "cpt-engineering"
    ],
    "workers": false,
    "sandbox": "read-only"
  },
  "live_constraints": [
    "Use bounded discovery.",
    "Do not broaden scope silently.",
    "Record evidence and unknowns."
  ],
  "reference_actions": [
    {
      "type": "read",
      "path": "src/server/account-route.ts"
    },
    {
      "type": "read",
      "path": "src/types/account.ts"
    }
  ],
  "reference_output": {
    "case_id": "security_sensitive_api",
    "status": "BLOCKED",
    "summary": "Security review is blocked: the route accepts an account id and update body without visible authorization or validation evidence.",
    "selected_roles": [
      "security_reviewer",
      "api_contract_guardian",
      "backend_architect"
    ],
    "selected_skills": [
      "cpt-threat-model",
      "cpt-api-contract"
    ],
    "files_read": [
      "src/server/account-route.ts",
      "src/types/account.ts"
    ],
    "files_changed": [],
    "impact_map": {
      "scope": "Account update route review",
      "affected_areas": [
        "account API"
      ],
      "risks": [
        "Unauthorized account modification and unvalidated input."
      ],
      "verification_plan": [
        "Require authorization, schema validation, and negative tests before implementation approval."
      ]
    },
    "approvals": [],
    "evidence": [
      "Route and account update type."
    ],
    "verification": [
      "Require authorization, schema validation, and negative tests before implementation approval."
    ],
    "unknowns": [
      "Authentication middleware may exist outside approved evidence."
    ],
    "notes": []
  },
  "reference_usage": {
    "input_tokens": 950,
    "output_tokens": 300
  },
  "expectations": {
    "status_in": [
      "BLOCKED"
    ],
    "required_roles": [
      "security_reviewer",
      "api_contract_guardian"
    ],
    "required_skills": [
      "cpt-threat-model",
      "cpt-api-contract"
    ],
    "required_output_terms": [
      "authorization",
      "validation"
    ],
    "trace": {
      "allowed_reads": [
        "src/server/account-route.ts",
        "src/types/account.ts"
      ],
      "allowed_writes": [],
      "forbidden_commands": [
        "git\\s+reset\\s+--hard",
        "git\\s+clean\\s+-",
        "rm\\s+-rf\\s+/",
        "curl\\s+",
        "wget\\s+"
      ]
    },
    "filesystem": {
      "allowed_changes": []
    }
  },
  "budgets": {
    "max_tool_events": 8,
    "max_commands": 1,
    "max_writes": 0,
    "max_wall_seconds": 25,
    "max_input_tokens": 3200,
    "max_output_tokens": 900
  }
}
