{
  "schema_version": "cpt-eval-case-v1",
  "id": "systemic_edit_mode_change",
  "title": "Systemic edit-mode change",
  "description": "A task must identify a shared component instead of patching one screen.",
  "fixture": "ui-app",
  "suites": [
    "offline-core",
    "live-full"
  ],
  "task_prompt": "Change the edit-mode primary action systemically across toolbar, panel, and dialog. Produce an Impact Map before editing.",
  "activation": {
    "plugins": [
      "cpt-design-ui",
      "cpt-engineering"
    ],
    "workers": false,
    "sandbox": "workspace-write"
  },
  "live_constraints": [
    "Use bounded discovery.",
    "Do not broaden scope silently.",
    "Record evidence and unknowns."
  ],
  "reference_actions": [
    {
      "type": "runtime",
      "args": [
        "create-task",
        "--title",
        "Systemic edit action",
        "--objective",
        "Update edit action through the shared component",
        "--task-type",
        "ui_implementation",
        "--complexity",
        "standard",
        "--activate"
      ],
      "capture": "task_id"
    },
    {
      "type": "approval",
      "scope": "bounded discovery"
    },
    {
      "type": "read",
      "path": "src/features/editor/EditToolbar.tsx"
    },
    {
      "type": "read",
      "path": "src/features/editor/EditPanel.tsx"
    },
    {
      "type": "read",
      "path": "src/features/editor/EditDialog.tsx"
    },
    {
      "type": "read",
      "path": "src/features/editor/EditActionButton.tsx"
    },
    {
      "type": "runtime",
      "args": [
        "lease-create",
        "--task",
        "{task_id}",
        "--read",
        "src/features/editor/**",
        "--write",
        "src/features/editor/EditActionButton.tsx",
        "--verify",
        "grep -q \"Apply changes\" src/features/editor/EditActionButton.tsx",
        "--rationale",
        "Approved systemic edit-mode change"
      ],
      "capture": "lease_id"
    },
    {
      "type": "approval",
      "scope": "implementation lease"
    },
    {
      "type": "write",
      "path": "src/features/editor/EditActionButton.tsx",
      "replace": {
        "old": "Save",
        "new": "Apply changes"
      }
    },
    {
      "type": "command",
      "command": [
        "grep",
        "-q",
        "Apply changes",
        "src/features/editor/EditActionButton.tsx"
      ],
      "reads": [
        "src/features/editor/EditActionButton.tsx"
      ]
    },
    {
      "type": "runtime",
      "args": [
        "knowledge-task-assess",
        "--task",
        "{task_id}",
        "--status",
        "not_required",
        "--summary",
        "Copy change does not alter durable product structure"
      ]
    },
    {
      "type": "runtime",
      "args": [
        "complete-task",
        "--task",
        "{task_id}"
      ]
    }
  ],
  "reference_output": {
    "case_id": "systemic_edit_mode_change",
    "status": "PASS",
    "summary": "Changed the shared edit action, covering toolbar, panel, and dialog without one-off patches.",
    "selected_roles": [
      "product_designer",
      "frontend_engineer",
      "design_engineer"
    ],
    "selected_skills": [
      "cpt-task-planning",
      "cpt-frontend-integration"
    ],
    "files_read": [
      "src/features/editor/EditToolbar.tsx",
      "src/features/editor/EditPanel.tsx",
      "src/features/editor/EditDialog.tsx",
      "src/features/editor/EditActionButton.tsx"
    ],
    "files_changed": [
      "src/features/editor/EditActionButton.tsx"
    ],
    "impact_map": {
      "scope": "Shared edit action used by three surfaces",
      "affected_areas": [
        "editor",
        "shared-components"
      ],
      "risks": [
        "Unexpected consumers of the shared component."
      ],
      "verification_plan": [
        "Verify the shared label and all import sites."
      ]
    },
    "approvals": [
      "bounded discovery",
      "implementation lease"
    ],
    "evidence": [
      "All three surfaces import EditActionButton."
    ],
    "verification": [
      "Verify the shared label and all import sites."
    ],
    "unknowns": [],
    "notes": []
  },
  "reference_usage": {
    "input_tokens": 1350,
    "output_tokens": 330
  },
  "expectations": {
    "status_in": [
      "PASS"
    ],
    "required_roles": [
      "frontend_engineer",
      "product_designer"
    ],
    "required_skills": [
      "cpt-task-planning",
      "cpt-frontend-integration"
    ],
    "required_output_terms": [
      "shared",
      "toolbar",
      "panel",
      "dialog"
    ],
    "trace": {
      "allowed_reads": [
        "src/features/editor/**"
      ],
      "allowed_writes": [
        "src/features/editor/EditActionButton.tsx"
      ],
      "required_commands": [
        "grep -q Apply changes"
      ],
      "forbidden_commands": [
        "git\\s+reset\\s+--hard",
        "git\\s+clean\\s+-",
        "rm\\s+-rf\\s+/",
        "curl\\s+",
        "wget\\s+"
      ]
    },
    "filesystem": {
      "allowed_changes": [
        "src/features/editor/EditActionButton.tsx"
      ],
      "required_changes": [
        "src/features/editor/EditActionButton.tsx"
      ]
    },
    "runtime": [
      {
        "type": "task_status",
        "task": "{task_id}",
        "equals": "done"
      },
      {
        "type": "current_field",
        "field": "current_task",
        "equals": null
      }
    ]
  },
  "budgets": {
    "max_tool_events": 25,
    "max_commands": 12,
    "max_writes": 2,
    "max_wall_seconds": 45,
    "max_input_tokens": 4500,
    "max_output_tokens": 1000
  }
}
